{
  "inputs": {
    "run": "1111111111111111111111111111111111111111111111111111111111111111",
    "scope": "2222222222222222222222222222222222222222222222222222222222222222",
    "claimed": "3333333333333333333333333333333333333333333333333333333333333333",
    "gate-result": "4444444444444444444444444444444444444444444444444444444444444444",
    "coverage": "5555555555555555555555555555555555555555555555555555555555555555",
    "examined": "7777777777777777777777777777777777777777777777777777777777777777",
    "packets": "8888888888888888888888888888888888888888888888888888888888888888",
    "receipts": "9999999999999999999999999999999999999999999999999999999999999999",
    "rejects": "aaaaaaaaaaaaaaaaaaaaaaaaaaaaaaaaaaaaaaaaaaaaaaaaaaaaaaaaaaaaaaaa",
    "unlocated": "bbbbbbbbbbbbbbbbbbbbbbbbbbbbbbbbbbbbbbbbbbbbbbbbbbbbbbbbbbbbbbbb"
  },
  "report_sha256": "cccccccccccccccccccccccccccccccccccccccccccccccccccccccccccccccc",
  "template": "review",
  "template_version": 1,
  "tool_version": "1.0.0"
}
